{"schemaVersion":1,"apiVersion":"v1","generatedAt":"2026-10-03T02:13:15Z","predicateType":"https://prometheusroot.github.io/omarchy-plugin-check/attestation/security-review/v1","catalogGeneratedAt":"2026-10-03T02:07:11.179Z","registry":{"version":1,"expires":"2026-10-31T00:00:00Z","dev":true,"signed":true},"providers":[{"id":"opc","name":"omarchy-plugin-check (DEV, unsigned)","tier":"core","verification":"unsigned-dev","feedVersion":1790993554,"feedExpires":"2026-11-02T02:12:34Z","rows":3,"status":"ok"},{"id":"marketplace","name":"Omarchy marketplace baseline","tier":"unsigned","verification":"unsigned","feedVersion":null,"feedExpires":null,"rows":4641,"status":"ok"},{"id":"example","name":"Example verified provider (fixture)","tier":"verified","verification":"sigstore","feedVersion":1,"feedExpires":"2026-10-31T00:00:00Z","rows":1,"status":"ok"}],"pluginCount":9,"counts":{"safe":0,"caution":4,"risky":1,"blocked":1,"unknown":5},"rejected":[]}
